{
  "id": "01KGQBHCAPP7RNATMN0YRCRHT2",
  "projectId": "astroduck_demo",
  "specId": "spec_astroduck_projectile_seq",
  "createdAt": "2026-02-05T19:08:33.769Z",
  "updatedAt": "2026-02-05T19:17:18.136Z",
  "versions": [
    {
      "id": "01KGQK1N1C7KCRTZZKHWW91QBX",
      "createdAt": "2026-02-05T19:08:33.769Z",
      "status": "deprecated",
      "generation": {
        "promptId": "17a33ecb-3fa7-4829-9279-f66e48f1eba3",
        "spec": {
          "id": "spec_astroduck_projectile_seq",
          "title": "Projectile: Missile (sequence)",
          "assetType": "spritesheet"
        },
        "promptExample": {
          "positive": "sci-fi comic, bold outlines, high contrast, clean shapes, missile projectile, small rocket with flame, transparent background, loopable frames",
          "negative": "(worst quality, low quality, illustration, 3d, 2d), open mouth, tooth, ugly face, old face, long neck, photo, clutter, text, watermark, low contrast"
        },
        "sequenceId": "01KGQBHCAPP7RNATMN0YRCRHT2",
        "frameIndex": 0,
        "frameCount": 8,
        "frameName": "frame_01"
      },
      "variants": [
        {
          "id": "01KGQK9HHYGKJP21834FVCSMQE",
          "originalPath": "projects/astroduck_demo/files/images/01KGQBHCAPP7RNATMN0YRCRHT2/original/01KGQK9HHYGKJP21834FVCSMQE.png",
          "status": "candidate"
        },
        {
          "id": "01KGQK9HJ1WX245BP44PBVS06T",
          "originalPath": "projects/astroduck_demo/files/images/01KGQBHCAPP7RNATMN0YRCRHT2/original/01KGQK9HJ1WX245BP44PBVS06T.png",
          "status": "candidate"
        },
        {
          "id": "01KGQK9HJFB0B1XPDZF6KV74XV",
          "originalPath": "projects/astroduck_demo/files/images/01KGQBHCAPP7RNATMN0YRCRHT2/original/01KGQK9HJFB0B1XPDZF6KV74XV.png",
          "status": "candidate"
        },
        {
          "id": "01KGQK9HJXVZW5C0HFJ61A6RJ9",
          "originalPath": "projects/astroduck_demo/files/images/01KGQBHCAPP7RNATMN0YRCRHT2/original/01KGQK9HJXVZW5C0HFJ61A6RJ9.png",
          "status": "candidate"
        }
      ]
    },
    {
      "id": "01KGQK5KSM4QH4QB0R64DB2C19",
      "createdAt": "2026-02-05T19:10:43.603Z",
      "status": "deprecated",
      "generation": {
        "promptId": "0fdae692-a631-483d-abd1-485af74103c2",
        "spec": {
          "id": "spec_astroduck_projectile_seq",
          "title": "Projectile: Missile (sequence)",
          "assetType": "spritesheet"
        },
        "promptExample": {
          "positive": "sci-fi comic, bold outlines, high contrast, clean shapes, missile projectile, small rocket with flame, transparent background, loopable frames",
          "negative": "(worst quality, low quality, illustration, 3d, 2d), open mouth, tooth, ugly face, old face, long neck, photo, clutter, text, watermark, low contrast"
        },
        "sequenceId": "01KGQBHCAPP7RNATMN0YRCRHT2",
        "frameIndex": 1,
        "frameCount": 8,
        "frameName": "frame_02"
      },
      "variants": [
        {
          "id": "01KGQKDGAPAYNYEFYYT3CA12X9",
          "originalPath": "projects/astroduck_demo/files/images/01KGQBHCAPP7RNATMN0YRCRHT2/original/01KGQKDGAPAYNYEFYYT3CA12X9.png",
          "status": "candidate"
        },
        {
          "id": "01KGQKDGB6XAXQASEFHXWMDC8W",
          "originalPath": "projects/astroduck_demo/files/images/01KGQBHCAPP7RNATMN0YRCRHT2/original/01KGQKDGB6XAXQASEFHXWMDC8W.png",
          "status": "candidate"
        },
        {
          "id": "01KGQKDGBQHSQM25PAX7CNQ99F",
          "originalPath": "projects/astroduck_demo/files/images/01KGQBHCAPP7RNATMN0YRCRHT2/original/01KGQKDGBQHSQM25PAX7CNQ99F.png",
          "status": "candidate"
        },
        {
          "id": "01KGQKDGC5JXMRGYBK4ZHDSDM9",
          "originalPath": "projects/astroduck_demo/files/images/01KGQBHCAPP7RNATMN0YRCRHT2/original/01KGQKDGC5JXMRGYBK4ZHDSDM9.png",
          "status": "candidate"
        }
      ]
    },
    {
      "id": "01KGQK9K51EDV4QPRNDXM8CVFH",
      "createdAt": "2026-02-05T19:12:54.626Z",
      "status": "deprecated",
      "generation": {
        "promptId": "38380f61-a11b-403d-8f7c-c2ec516cd792",
        "spec": {
          "id": "spec_astroduck_projectile_seq",
          "title": "Projectile: Missile (sequence)",
          "assetType": "spritesheet"
        },
        "promptExample": {
          "positive": "sci-fi comic, bold outlines, high contrast, clean shapes, missile projectile, small rocket with flame, transparent background, loopable frames",
          "negative": "(worst quality, low quality, illustration, 3d, 2d), open mouth, tooth, ugly face, old face, long neck, photo, clutter, text, watermark, low contrast"
        },
        "sequenceId": "01KGQBHCAPP7RNATMN0YRCRHT2",
        "frameIndex": 2,
        "frameCount": 8,
        "frameName": "frame_03"
      },
      "variants": [
        {
          "id": "01KGQKHG9R5GH37DSCN1C7H44W",
          "originalPath": "projects/astroduck_demo/files/images/01KGQBHCAPP7RNATMN0YRCRHT2/original/01KGQKHG9R5GH37DSCN1C7H44W.png",
          "status": "candidate"
        },
        {
          "id": "01KGQKHG9VMKDY4NCCJJKEBMDJ",
          "originalPath": "projects/astroduck_demo/files/images/01KGQBHCAPP7RNATMN0YRCRHT2/original/01KGQKHG9VMKDY4NCCJJKEBMDJ.png",
          "status": "candidate"
        },
        {
          "id": "01KGQKHGA8K4VJ2N9N65BN1BZC",
          "originalPath": "projects/astroduck_demo/files/images/01KGQBHCAPP7RNATMN0YRCRHT2/original/01KGQKHGA8K4VJ2N9N65BN1BZC.png",
          "status": "candidate"
        },
        {
          "id": "01KGQKHGAMPY5H9KZC3K8FH10S",
          "originalPath": "projects/astroduck_demo/files/images/01KGQBHCAPP7RNATMN0YRCRHT2/original/01KGQKHGAMPY5H9KZC3K8FH10S.png",
          "status": "candidate"
        }
      ]
    },
    {
      "id": "01KGQKDHZ63P6K0YKBFR8SKC03",
      "createdAt": "2026-02-05T19:15:05.367Z",
      "status": "deprecated",
      "generation": {
        "promptId": "bee795de-2f7f-4274-b384-55e876dff920",
        "spec": {
          "id": "spec_astroduck_projectile_seq",
          "title": "Projectile: Missile (sequence)",
          "assetType": "spritesheet"
        },
        "promptExample": {
          "positive": "sci-fi comic, bold outlines, high contrast, clean shapes, missile projectile, small rocket with flame, transparent background, loopable frames",
          "negative": "(worst quality, low quality, illustration, 3d, 2d), open mouth, tooth, ugly face, old face, long neck, photo, clutter, text, watermark, low contrast"
        },
        "sequenceId": "01KGQBHCAPP7RNATMN0YRCRHT2",
        "frameIndex": 3,
        "frameCount": 8,
        "frameName": "frame_04"
      },
      "variants": [
        {
          "id": "01KGQKNFYYGHB3Y1AWC32C36NJ",
          "originalPath": "projects/astroduck_demo/files/images/01KGQBHCAPP7RNATMN0YRCRHT2/original/01KGQKNFYYGHB3Y1AWC32C36NJ.png",
          "status": "candidate"
        },
        {
          "id": "01KGQKNFZGQ7TC9XCBAHM60WEF",
          "originalPath": "projects/astroduck_demo/files/images/01KGQBHCAPP7RNATMN0YRCRHT2/original/01KGQKNFZGQ7TC9XCBAHM60WEF.png",
          "status": "candidate"
        },
        {
          "id": "01KGQKNFZY27NZM75CG6NJEVCX",
          "originalPath": "projects/astroduck_demo/files/images/01KGQBHCAPP7RNATMN0YRCRHT2/original/01KGQKNFZY27NZM75CG6NJEVCX.png",
          "status": "candidate"
        },
        {
          "id": "01KGQKNG0C4EX94PRE1D108CTB",
          "originalPath": "projects/astroduck_demo/files/images/01KGQBHCAPP7RNATMN0YRCRHT2/original/01KGQKNG0C4EX94PRE1D108CTB.png",
          "status": "candidate"
        }
      ]
    },
    {
      "id": "01KGQKHHXM2HEGQPG2T03J9MQR",
      "createdAt": "2026-02-05T19:17:18.136Z",
      "status": "review",
      "generation": {
        "promptId": "5aed306f-760f-4562-b4e8-4b8a366eee18",
        "spec": {
          "id": "spec_astroduck_projectile_seq",
          "title": "Projectile: Missile (sequence)",
          "assetType": "spritesheet"
        },
        "promptExample": {
          "positive": "sci-fi comic, bold outlines, high contrast, clean shapes, missile projectile, small rocket with flame, transparent background, loopable frames",
          "negative": "(worst quality, low quality, illustration, 3d, 2d), open mouth, tooth, ugly face, old face, long neck, photo, clutter, text, watermark, low contrast"
        },
        "sequenceId": "01KGQBHCAPP7RNATMN0YRCRHT2",
        "frameIndex": 4,
        "frameCount": 8,
        "frameName": "frame_05"
      },
      "variants": [
        {
          "id": "01KGQKSHMPR9ZSHN31MWWP73PC",
          "originalPath": "projects/astroduck_demo/files/images/01KGQBHCAPP7RNATMN0YRCRHT2/original/01KGQKSHMPR9ZSHN31MWWP73PC.png",
          "status": "candidate"
        },
        {
          "id": "01KGQKSHMRQQBE9WGKCC8S9W2E",
          "originalPath": "projects/astroduck_demo/files/images/01KGQBHCAPP7RNATMN0YRCRHT2/original/01KGQKSHMRQQBE9WGKCC8S9W2E.png",
          "status": "candidate"
        },
        {
          "id": "01KGQKSHN45X2XAHYG01Y22DCD",
          "originalPath": "projects/astroduck_demo/files/images/01KGQBHCAPP7RNATMN0YRCRHT2/original/01KGQKSHN45X2XAHYG01Y22DCD.png",
          "status": "candidate"
        },
        {
          "id": "01KGQKSHND4E73YDGFF3CQXMNK",
          "originalPath": "projects/astroduck_demo/files/images/01KGQBHCAPP7RNATMN0YRCRHT2/original/01KGQKSHND4E73YDGFF3CQXMNK.png",
          "status": "candidate"
        }
      ]
    }
  ]
}
